ID,Solicitation Title,Status,Solicitation ID,URL
123,Research Opportunities in Physical Sciences (ROPS),Open,NNH20ZDA012N,https://nspires.nasaprs.com/external/solicitations/summary!init.do?solId={D9D65C42-4CF6-8775-EA06-B9860E2B3C1F}&path=open
124,Research Opportunities in Space and Earth Sciences 2024 (ROSES-2024),Open,NNH24ZDA001N,https://nspires.nasaprs.com/external/solicitations/summary!init.do?solId={600EE5E5-E9D5-FF55-0CAD-764F6D4BEEA9}&path=open
125,Science Mission Directorate Single-Source - by invitation only (2024),Open,SMDSS24,https://nspires.nasaprs.com/external/solicitations/summary!init.do?solId={2E6F2455-FE7B-A021-4F6D-8DE178A21408}&path=open
126,Space Technology Research Development Demonstration and Infusion (SpaceTech REDDI),Open,NNH24ZTR001N,https://nspires.nasaprs.com/external/solicitations/summary!init.do?solId={12BC22A2-6DD9-47F7-BC2B-E9147A2C5977}&path=open
127,Space Technology Research Development Demonstration and Infusion (SpaceTech REDDI),Open,NNH25ZTR001N,https://nspires.nasaprs.com/external/solicitations/summary!init.do?solId={6DE6AFEA-9750-2502-931F-D05584D1A3CE}&path=open
128,Topical Workshops Symposiums and Conferences (TWSC-24) in Space and Earth Sciences and Technology,Open,NNH24ZDA002N,https://nspires.nasaprs.com/external/solicitations/summary!init.do?solId={805EEF3B-DC64-A447-3EAD-66D23A9501EE}&path=open
129,TRISH Announcement Soliciting Postdoctoral Fellowship Applications,Open,TRISHRFA2501PD,https://nspires.nasaprs.com/external/solicitations/summary!init.do?solId={5F6054B3-ABD0-2160-5A54-DC2FC0B54566}&path=open
130,University Student Research Challenge (USRC),Open,NNH24ZEA001N-USRC,https://nspires.nasaprs.com/external/solicitations/summary!init.do?solId={F97021D4-09B1-92EF-44F9-692818541E49}&path=open
131,XMM-Newton C Targets for Fiscal Year 2025,Open,XMMNCT_FY25,https://nspires.nasaprs.com/external/solicitations/summary!init.do?solId={0BA5A904-60AF-8EF7-04DC-E409F8DDD171}&path=open
